{
  "imageRegistry": "dreamsports.jfrog.io",
  "imageRepository": "d11-docker-artifacts/aerospike",
  "imageTag": "4.3.0.8",
  "storageClass": "gp2",
  "nodeSelector": "ON_DEMAND",
  "replicaCount": 1,
  "resources": {
    "limits": {
      "cpu": "1000m",
      "memory": "4000Mi",
      "ephemeralStorage": "2Gi"
    },
    "requests": {
      "cpu": "500m",
      "memory": "3000Mi",
      "ephemeralStorage": "1Gi"
    }
  }
}
